title,category,Script,completed
What is a computer? (Basic explanation),Computer Basics & IT Concepts,"🗣️ ""Have you ever wondered how this tiny device in your hand or the big machine on your desk actually works? Well, let's break it down!""

A computer is an electronic device that processes data and performs tasks based on a set of instructions. It follows a simple cycle:
✅ Input (You press a key or click a button)
✅ Processing (The CPU calculates and decides what to do)
✅ Output (You see the result on the screen)

The first fully functional computer, called ENIAC, was built in 1945, and it weighed over 27 tons—basically the size of a room! Today, your smartphone is millions of times more powerful than those early machines.

Computers are now everywhere—running cars, controlling satellites, and even diagnosing diseases! So next time you use one, just remember… it’s more than just a screen and keyboard—it’s a powerful brain that never sleeps! 💻🚀",
Server Request Response,Computer Basics & IT Concepts,,TRUE
"What is called server, client, browser",Computer Basics & IT Concepts,,TRUE
What is software vs. hardware?,Computer Basics & IT Concepts,"🗣️ ""Have you ever wondered what actually makes a computer work? It's a mix of two things—hardware and software! Let me explain in the simplest way possible.""

🖥️ Hardware is everything you can physically touch—the keyboard, mouse, CPU, RAM, and even your screen. Think of it like the body of a car.
💾 Software is the set of instructions that tell the hardware what to do—like the apps you use, from Chrome to Photoshop. This is like the driver of the car.

Without hardware, software can’t run. And without software, hardware is just a useless box of circuits. That’s why they must work together!

By 2030, the global software industry is expected to hit $1 trillion, and without software, we wouldn't have things like AI, mobile apps, or even this video you’re watching right now! Crazy, right? 🚀",
"What is an operating system? (Windows, macOS, Linux)",Computer Basics & IT Concepts,"🗣️ ""Windows, macOS, Linux—why do we even need an operating system, and which one is best? Let’s break it down!""

An Operating System (OS) is what makes a computer usable. It manages the hardware, runs software, and controls everything from your files to the internet connection.

Windows is the most popular, with over 70% of the market share. It’s great for gaming and business.
macOS is sleek and optimized for Apple devices, used by about 15% of users, mostly professionals and creatives.
Linux is the king of servers, running 90% of cloud infrastructure, and it’s completely free and open-source!
Without an OS, your computer wouldn’t even boot up! So next time your PC lags, don’t just blame the hardware—your OS plays a huge role too! Which one do you prefer? Let me know in the comments! ⬇️",
What is RAM and why is it important?,Computer Basics & IT Concepts,"🗣️ ""Ever opened too many tabs and suddenly your computer slows down? That’s your RAM screaming for help! But what exactly is RAM?""

RAM stands for Random Access Memory—it’s your computer’s short-term memory. The more RAM you have, the more tasks your system can handle at once.

🔹 8GB RAM – Great for basic tasks like browsing and watching YouTube.
🔹 16GB RAM – Ideal for gaming, video editing, and multitasking.
🔹 32GB+ RAM – Required for heavy programming, 3D rendering, and professional tasks.

A fun fact—modern RAM modules are over 100,000 times faster than hard drives, which is why more RAM = faster performance!

So, if your PC slows down, before blaming your processor, check your RAM! If it’s not enough, an upgrade might just save your system! 🚀💾",
What is a CPU? (How it works),Computer Basics & IT Concepts,,
What is a hard drive vs. SSD? (Storage types explained),Computer Basics & IT Concepts,,
What is an IP address? (Simple explanation),Computer Basics & IT Concepts,,
What is a computer virus? (How to stay safe),Computer Basics & IT Concepts,,
What is cloud computing? (Basic overview),Computer Basics & IT Concepts,,
What is a server? (Basic explanation),Computer Basics & IT Concepts,,
What is a website? (Basic explanation),Web Development Basics,,
What is HTML? (Why it’s essential),Web Development Basics,,
What is CSS? (How it styles websites),Web Development Basics,,
What is JavaScript? (Why it’s important),Web Development Basics,,
Will Web Design be taken over by AI,Web Development Basics,,TRUE
Difference between Bootstrap and Tailwind CSS,Web Development Basics,,TRUE
Don't make these 5 mistakes when building a website,Web Development Basics,,TRUE
HTML vs. CSS vs. JavaScript - What’s the difference?,Web Development Basics,,
What is a domain name? (How it works),Web Development Basics,,
What is web hosting? (Basic explanation),Web Development Basics,,
"What is a CMS? (WordPress, Shopify, etc.)",Web Development Basics,,
What is a landing page? (Why it’s important),Web Development Basics,,
What is responsive web design?,Web Development Basics,,
What is programming? (Simple explanation),Programming Fundamentals,,
What is a programming language? (Basic overview),Programming Fundamentals,,
Importance of jQuery in 2025,Programming Fundamentals,,TRUE
What is Python? (Why beginners love it),Programming Fundamentals,,
What is PHP? (How it powers websites),Programming Fundamentals,,
What is JavaScript used for? (Examples),Programming Fundamentals,,
What is React.js? (Why developers use it),Programming Fundamentals,,
What is Node.js? (Backend JavaScript explained),Programming Fundamentals,,
What is a function in programming?,Programming Fundamentals,,
What is a variable in coding?,Programming Fundamentals,,
What is a loop in programming?,Programming Fundamentals,,
What is Python? (Why it’s popular),Python Basics,,
What is a Python function? (Basic explanation),Python Basics,,
What is a Python list? (How it works),Python Basics,,
What is a Python dictionary? (Simple example),Python Basics,,
What are Python libraries? (Best ones to know),Python Basics,,
How Python is used in data science,Python Basics,,
What is Django? (How it helps in web development),Python Basics,,
What is Flask? (Python for web apps),Python Basics,,
Python vs. JavaScript - Which one should you learn?,Python Basics,,
What is an API in Python? (Basic explanation),Python Basics,,
What is JavaScript? (Why it’s essential),JavaScript Basics,,
What is an event in JavaScript? (Simple example),JavaScript Basics,,
What is an array in JavaScript? (How it works),JavaScript Basics,,
What is the DOM? (Why it matters),JavaScript Basics,,
How JavaScript makes websites interactive,JavaScript Basics,,
What is AJAX? (Why it’s used),JavaScript Basics,,
What is JSON? (Why it’s important),JavaScript Basics,,
What is an API in JavaScript?,JavaScript Basics,,
JavaScript vs. Python - Which one is better?,JavaScript Basics,,
"What is a JavaScript framework? (React, Angular, Vue)",JavaScript Basics,,
What is UI design? (Why it’s important),Web Design & UI/UX Basics,,
What is UX design? (How it improves websites),Web Design & UI/UX Basics,,
UI vs. UX - What’s the difference?,Web Design & UI/UX Basics,,
What are wireframes? (How they help in design),Web Design & UI/UX Basics,,
Why typography is important in web design,Web Design & UI/UX Basics,,
Importance of fonts in website design,Web Design & UI/UX Basics,,TRUE
Lightmode and Darkmode,Web Design & UI/UX Basics,,TRUE
Difference between UI and UX,Web Design & UI/UX Basics,,TRUE
Difference between graphic design and website design,Web Design & UI/UX Basics,,TRUE
What are the top UI/UX design trends in 2025?,Web Design & UI/UX Basics,,
What are the best free tools for UI/UX design?,Web Design & UI/UX Basics,,
How to choose colors for a website?,Web Design & UI/UX Basics,,
What are the principles of good web design?,Web Design & UI/UX Basics,,
What is a mockup in web design?,Web Design & UI/UX Basics,,
What is WordPress? (Why it’s so popular),WordPress & CMS Basics,,
How to start a blog with WordPress?,WordPress & CMS Basics,,
WordPress vs. Shopify - Which one is better?,WordPress & CMS Basics,,
What is a WordPress plugin? (Why they’re useful),WordPress & CMS Basics,,
How to secure a WordPress website?,WordPress & CMS Basics,,
What is WooCommerce? (How it helps online stores),WordPress & CMS Basics,,
WordPress vs. Webflow - Which one to choose?,WordPress & CMS Basics,,
What is Elementor? (No-code website building),WordPress & CMS Basics,,
How to choose a theme for WordPress?,WordPress & CMS Basics,,
What is a website builder? (Best tools),WordPress & CMS Basics,,
What is PHP? (How it runs the web),PHP & Backend Basics,,
What is Laravel? (Why PHP developers love it),PHP & Backend Basics,,
What is MySQL? (Why databases matter),PHP & Backend Basics,,
PHP vs. Python - Which one is better?,PHP & Backend Basics,,
How PHP handles forms (Simple explanation),PHP & Backend Basics,,
What is a backend in web development?,PHP & Backend Basics,,
What is an API in PHP? (Basic concept),PHP & Backend Basics,,
How PHP helps in eCommerce development,PHP & Backend Basics,,
5 must-know PHP functions for beginners,PHP & Backend Basics,,
What is database management? (Why it’s essential),PHP & Backend Basics,,
How to become a web developer? (Step-by-step),General Tech & Career Tips,,
How long does it take to learn coding?,General Tech & Career Tips,,
5 free websites to learn coding online,General Tech & Career Tips,,
What are the top coding jobs in 2025?,General Tech & Career Tips,,
Is web development a good career? (Pros & cons),General Tech & Career Tips,,
The best way to practice coding daily,General Tech & Career Tips,,
How to build your first website? (Easy guide),General Tech & Career Tips,,
5 common coding mistakes beginners make,General Tech & Career Tips,,
What is freelancing? (How to start),General Tech & Career Tips,,
Why problem-solving is important for programmers,General Tech & Career Tips,,
How AI is changing web development?,Fun & Engaging Tech Topics,,
What is ChatGPT? (How it works),Fun & Engaging Tech Topics,,
What is machine learning? (Basic intro),Fun & Engaging Tech Topics,,
What is a hackathon? (Why coders love them),Fun & Engaging Tech Topics,,
How websites looked in the 90s vs. now,Fun & Engaging Tech Topics,,
5 cool websites every developer should know,Fun & Engaging Tech Topics,,
What is the metaverse? (Why it’s trending),Fun & Engaging Tech Topics,,
What is Web 3.0? (Future of the internet),Fun & Engaging Tech Topics,,
The funniest coding memes (Compilation),Fun & Engaging Tech Topics,,
The most in-demand tech skills in 2025,Fun & Engaging Tech Topics,,
"What is a computer course, and why should you take one?",Computer Basics & IT Concepts,,
The difference between IT classes and coding classes,Computer Basics & IT Concepts,,
What is an operating system? (Windows vs. macOS vs. Linux),Computer Basics & IT Concepts,,
What is cloud computing? (Basic explanation),Computer Basics & IT Concepts,,
"What is a database, and why is it important?",Computer Basics & IT Concepts,,
What is Open Source software? (Why it matters),Computer Basics & IT Concepts,,
What is API? (Explained in simple terms),Computer Basics & IT Concepts,,
What is an IP address? (Public vs. Private IP),Computer Basics & IT Concepts,,
What is cybersecurity? (Basic tips for beginners),Computer Basics & IT Concepts,,
What is a website? (Simple explanation),Web Development Basics,,
"What is HTML, and why is it important?",Web Development Basics,,
What is CSS? (How it styles websites),Web Development Basics,,
HTML vs. CSS vs. JavaScript - What's the difference?,Web Development Basics,,
What is a domain name? (How it works),Web Development Basics,,
What is web hosting? (Shared vs. VPS vs. Dedicated),Web Development Basics,,
"What is a CMS? (Explaining WordPress, Shopify, etc.)",Web Development Basics,,
"What is a landing page, and why do businesses need one?",Web Development Basics,,
What is responsive web design? (Mobile-friendly websites),Web Development Basics,,
How to become a web developer? (Step-by-step guide),Web Development Basics,,
Front-end vs. Back-end Development - What’s the difference?,Web Development Basics,,
What are the skills required for a web developer?,Web Development Basics,,
How long does it take to learn web development?,Web Development Basics,,
"What are web development frameworks? (React, Angular, Vue)",Web Development Basics,,
Is web development a good career in 2025?,Web Development Basics,,
What is programming? (Simple explanation),Programming Fundamentals,,
What is an algorithm? (How it helps in coding),Programming Fundamentals,,
What is an IDE? (Best coding environments for beginners),Programming Fundamentals,,
What is a programming loop? (Basic explanation),Programming Fundamentals,,
What is an array in programming? (Explained with examples),Programming Fundamentals,,
The easiest way to start learning coding today,Programming Fundamentals,,
5 free resources to learn coding online,Programming Fundamentals,,
The best websites to practice coding for free,Programming Fundamentals,,
Why problem-solving is important for programmers,Programming Fundamentals,,
What is Python? (Why is it a great beginner language?),Python Basics,,
Why should you learn Python in 2025?,Python Basics,,
What is a Python function? (Basic explanation),Python Basics,,
What is a variable in Python? (Simple terms),Python Basics,,
Python vs. JavaScript - Which one should you learn?,Python Basics,,
What is Django? (How it helps in web development),Python Basics,,
What is Flask? (Why it’s used in Python development),Python Basics,,
How Python is used in data science,Python Basics,,
What is an API in Python? (Simple explanation),Python Basics,,
What are Python libraries? (Best ones to know),Python Basics,,
The difference between Python 2 and Python 3,Python Basics,,
What is JavaScript? (Why it's essential for web development),JavaScript Basics,,
What is JavaScript used for? (Front-end & Back-end examples),JavaScript Basics,,
What is React.js? (Why developers love it),JavaScript Basics,,
What is Node.js? (Why use JavaScript for the backend?),JavaScript Basics,,
What is the Document Object Model (DOM)?,JavaScript Basics,,
Why is JavaScript called a scripting language?,JavaScript Basics,,
What is an event listener in JavaScript?,JavaScript Basics,,
What is React.js used for? (Simple explanation),JavaScript Basics,,
How to add animations using JavaScript?,JavaScript Basics,,
What is AJAX? (How it makes websites dynamic),JavaScript Basics,,
5 common JavaScript mistakes beginners make,JavaScript Basics,,
"What is a JavaScript framework? (React, Angular, Vue)",JavaScript Basics,,
How JavaScript improves website performance,JavaScript Basics,,
"What is TypeScript, and why should you learn it?",JavaScript Basics,,
What are the benefits of learning JavaScript?,JavaScript Basics,,
What is UI design? (Why is it important?),Web Design & UI/UX Basics,,
What is UX design? (How it improves user experience),Web Design & UI/UX Basics,,
UI vs. UX - What’s the difference?,Web Design & UI/UX Basics,,
5 common UI design mistakes beginners make,Web Design & UI/UX Basics,,
What are wireframes? (How they help in UI/UX design),Web Design & UI/UX Basics,,
Why color theory is important in graphic design,Web Design & UI/UX Basics,,
What are the best free tools for UI/UX design?,Web Design & UI/UX Basics,,
How to create a website layout in Photoshop?,Web Design & UI/UX Basics,,
The importance of typography in web design,Web Design & UI/UX Basics,,
What are the top UI/UX design trends in 2025?,Web Design & UI/UX Basics,,
What is WordPress? (Why 40% of websites use it),WordPress & CMS Basics,,
What are WordPress plugins? (Why they are important),WordPress & CMS Basics,,
How to start a blog with WordPress?,WordPress & CMS Basics,,
WordPress vs. Shopify - Which is better?,WordPress & CMS Basics,,
What is WooCommerce? (How it turns WordPress into an online store),WordPress & CMS Basics,,
5 must-have WordPress plugins for beginners,WordPress & CMS Basics,,
How to secure a WordPress website?,WordPress & CMS Basics,,
What is Elementor? (How to build a website without coding),WordPress & CMS Basics,,
WordPress vs. Webflow - Which one is better?,WordPress & CMS Basics,,
Why businesses need a website in 2025,WordPress & CMS Basics,,
What is PHP? (How it powers the web),PHP & Backend Basics,,
What is PHP used for? (Why it’s still popular),PHP & Backend Basics,,
PHP vs. JavaScript - Which one is better for the backend?,PHP & Backend Basics,,
What is Laravel? (Why PHP developers love it),PHP & Backend Basics,,
What is a MySQL database? (How it works with PHP),PHP & Backend Basics,,
How does PHP handle forms? (Simple explanation),PHP & Backend Basics,,
What is an API in PHP? (How it connects websites),PHP & Backend Basics,,
The importance of PHP in WordPress development,PHP & Backend Basics,,
How PHP helps in eCommerce website development,PHP & Backend Basics,,
PHP vs. Python - Which one is better for backend development?,PHP & Backend Basics,,
5 must-know PHP functions for beginners,PHP & Backend Basics,,
How to become a self-taught programmer?,General Tech & Career Tips,,
Is coding difficult? (Truth about learning to code),General Tech & Career Tips,,
How to make a career by learning web design,General Tech & Career Tips,,TRUE
Who is a Full Stack Developer?,General Tech & Career Tips,,TRUE
3 common myths about learning programming,General Tech & Career Tips,,
5 common myths about web design,General Tech & Career Tips,,
How to stay motivated while learning programming,General Tech & Career Tips,,
What is freelancing? (How to earn money with coding),General Tech & Career Tips,,
What are the top coding jobs in 2025?,General Tech & Career Tips,,
How AI is changing web development?,Fun & Engaging Tech Topics,,
The best websites to practice coding for free,Fun & Engaging Tech Topics,,
Why problem-solving is important for programmers,Fun & Engaging Tech Topics,,
How to start a career as a web designer?,Fun & Engaging Tech Topics,,
Will it harm your website if it opens slowly?,Fun & Engaging Tech Topics,,TRUE